ingredients,safe_ingredients,harmful_ingredients,general_health_assessment,toxicity_score,allergen_risk,regulatory_status
"Semoule de bié (GLUTEN), Tomate, poivron vert, Pomme, Oignon, Persil frisé, Menthe, Huile d'olive vierge extra, Jus de citron, sel.","['Semoule de bié (GLUTEN)', 'Tomate', 'poivron vert', 'Pomme']",[],All ingredients are safe for consumption.,Unknown,Unknown,Unknown
"Filets de caille 50 %, viande de porc, _pistache_ 3 %, oignons, vin blanc, porto, sel, épices, sucre, poivre, muscade.","['Filets de caille', 'viande de porc']",['pistache'],The product contains some safe and potentially harmful ingredients.,Unknown,Unknown,Unknown
"Boulghour de blé (gluten) cuit 48% [eau, boulghour de blé (gluten) 19,2%], courgette grillée 14,4%, pois chiche réhydraté 14,4% (eau, pois chiche 6,2%), tomate cerise 8%, eau, crème fraîche liquide légère (lait) 3,5%, huile d'olive vierge extra 2,8%, épices raz-el-hanout O,7%, jus de citron 0,5%, sel, purée d'ail, amidon de mais. Convient aux végétariens (régime lacto-ovo-végétarien)","['eau', 'boulghour de blé cuit 48%']",[],"Overall, the ingredients appear to be safe for consumption. However, individuals with celiac disease or gluten sensitivity should exercise caution as boulghour contains wheat (gluten).",Unknown,Unknown,Unknown
"Potato starch, sugar, salt, vegetable powder (chinese cabbage extract, dextrin), shiitake powder, dehydrated soy sauce (wheat, soybeans, maltodextrin, salt), dried tofu, dried carrot, dried green onion, dried shiitake, onion powder, ginger powder, citric acid, dehydrated miso (soybeans, rice, salt), chili pepper, white pepper, star anis",[],[],Error: Expecting value: line 1 column 1 (char 0),Unknown,Unknown,Unknown
"_camembert_ 60% (contient _lait_) - _lait_ écrémé reconstitué - _beurre_ - sels de fonte : e339, e452 - correcteur d'acidité : acide citrique - conservateur : sorbate de potassium - colorant : caroténoïdes. traces d'_oeufs_.","['lait', '_camembert']",[],"Overall, the product appears to be safe for consumption. However, individuals who are allergic or intolerant of dairy products should exercise caution when consuming this item.",Unknown,Unknown,Unknown
